{
  "$schema": "http://json-schema.org/draft-07/schema#",
  "$id": "https://github.com/metill-is/sports/config/publish-schemas/meta.schema.json",
  "title": "data/publish/.../meta.json",
  "description": "Per-cell metadata: identity (sport/sex/league/division/is_cup), provenance (fit_date, generated_at), and Stan-run scalars (n_draws, round). Schema v2 (2026-09): adds units, points, n_rounds, n_rounds_source, season_scope, postseason, qualify and relegation. Additive changes only without bumping. The v2 keys are typed here but not in `required`, because the live football tree predates them; each sport's delta requires the ones it emits.",
  "type": "object",
  "required": [
    "sport",
    "sex",
    "league",
    "division",
    "is_cup",
    "season",
    "generated_at",
    "fit_date",
    "round",
    "n_draws"
  ],
  "properties": {
    "sport": {
      "type": "string",
      "enum": [
        "football",
        "basketball",
        "handball"
      ]
    },
    "sex": {
      "type": "string",
      "enum": [
        "male",
        "female"
      ]
    },
    "league": {
      "type": "string",
      "minLength": 1
    },
    "division": {
      "type": "string",
      "pattern": "^[A-Z0-9][A-Z0-9_]*$",
      "description": "Division code from config/leagues.yml publish_divisions. The leading character may be a digit: basketball's second tier is coded 1D."
    },
    "is_cup": {
      "type": "boolean"
    },
    "season": {
      "type": "integer",
      "minimum": 2000,
      "maximum": 2200,
      "description": "The season the cell describes. The bounds are a typo guard only; the test fixture's far-future seasons run 2099-2101, and a 2DT cell between seasons publishes the next one."
    },
    "generated_at": {
      "type": "string",
      "pattern": "^\\d{4}-\\d{2}-\\d{2}T\\d{2}:\\d{2}:\\d{2}"
    },
    "fit_date": {
      "type": "string",
      "pattern": "^\\d{4}-\\d{2}-\\d{2}$"
    },
    "round": {
      "type": "integer",
      "minimum": 0
    },
    "n_draws": {
      "type": "integer",
      "minimum": 1
    },
    "n_rounds": {
      "type": [
        "integer",
        "null"
      ],
      "minimum": 1,
      "description": "Rounds in the REGULAR season, derived upstream and published so a consumer never has to guess it. null on a cup. It is not 2*(n_teams-1): Icelandic women's handball plays a triple round robin (8 teams, 84 fixtures, 21 rounds)."
    },
    "n_rounds_source": {
      "enum": [
        "config",
        "schedule",
        "none",
        "not_applicable"
      ],
      "description": "Where n_rounds came from. `config` = the division's configured expected_meetings (wins); `schedule` = derived from the season's fixture count; `none` = neither was available; `not_applicable` = a cup, which has no round count."
    },
    "n_rounds_meetings_source": {
      "enum": [
        "schedule",
        "config",
        "prior_results",
        "none",
        "not_applicable"
      ],
      "description": "Basketball and handball only (additive, 2026-09-16): where the meetings-per-pairing count behind n_rounds came from. `schedule` = the season's own complete fixture list; `config` = the division's expected_meetings; `prior_results` = the last completed season; `none` = no count, n_rounds fell back to the schedule; `not_applicable` = the division states regular_season_rounds instead. When set, n_rounds_source reads `config` whatever this says."
    },
    "units": {
      "type": "object",
      "description": "The scale the published strength and home-advantage bands are on, and the goal-difference bin width the extractor binned with. The 2DT models are additive in raw points/goals; football's bivariate Poisson is on the log scale. Getting this wrong is a home edge of 4 points publishing as 54.6.",
      "required": [
        "strength",
        "home_advantage",
        "diff_bin_width"
      ],
      "properties": {
        "strength": {
          "type": "string",
          "minLength": 1
        },
        "home_advantage": {
          "type": "string",
          "minLength": 1
        },
        "diff_bin_width": {
          "type": "integer",
          "minimum": 1
        }
      }
    },
    "points": {
      "type": "object",
      "description": "The league points scheme. `draw` is null where a draw is impossible (basketball), so no consumer infers one from a 0.",
      "required": [
        "win",
        "draw",
        "loss"
      ],
      "properties": {
        "win": {
          "type": "integer"
        },
        "draw": {
          "type": [
            "integer",
            "null"
          ]
        },
        "loss": {
          "type": "integer"
        }
      }
    },
    "season_scope": {
      "enum": [
        "full_season",
        "regular_season"
      ],
      "description": "What the published table and placement grid cover. `regular_season` means the post-season is NOT modelled, so placement 1 is top of the regular-season table and not the title."
    },
    "postseason": {
      "type": [
        "object",
        "null"
      ],
      "description": "The unmodelled post-season, or null where there is none. Present so a consumer can say what the published table stops short of.",
      "required": [
        "name_is",
        "modelled"
      ],
      "properties": {
        "name_is": {
          "type": "string",
          "minLength": 1
        },
        "modelled": {
          "type": "boolean"
        }
      }
    },
    "qualify": {
      "type": [
        "object",
        "null"
      ],
      "description": "The configured qualification cut, or null where the division has none. Only football's Besta deild configures one today: no single per-division integer describes basketball's four different post-season structures, one of which takes every team through.",
      "required": [
        "slots",
        "label_is"
      ],
      "properties": {
        "slots": {
          "type": "integer",
          "minimum": 1
        },
        "label_is": {
          "type": "string",
          "minLength": 1
        }
      }
    },
    "relegation": {
      "type": [
        "object",
        "null"
      ],
      "description": "The configured relegation cut. `slots` is null where no division configures relegation_slots, which is everywhere today.",
      "required": [
        "slots"
      ],
      "properties": {
        "slots": {
          "type": [
            "integer",
            "null"
          ],
          "minimum": 0
        }
      }
    },
    "split": {
      "type": "object",
      "description": "Split-season format (efri/nedri hluti): after the regular phase the table splits into an upper group of `upper` and a lower group of `lower` teams (single round-robin each, full carry-over, group-locked final table). Absent = flat league. With this field present, final_positions placement semantics are full-season: placement 1 = champion; relegation places are the bottom of the lower block.",
      "required": [
        "upper",
        "lower"
      ],
      "additionalProperties": false,
      "properties": {
        "upper": {
          "type": "integer",
          "minimum": 2
        },
        "lower": {
          "type": "integer",
          "minimum": 2
        }
      }
    }
  }
}
