{"sport":"football","sex":"female","league":"Besta deild","division":"BD","is_cup":false,"season":2026,"generated_at":"2026-10-24T17:32:44+0000","fit_date":"2026-10-19","round":21,"n_draws":4000,"split":{"upper":6,"lower":4},"n_rounds":23,"n_rounds_source":"schedule","units":{"strength":"log_goals","home_advantage":"goal_multiplier","diff_bin_width":1},"points":{"win":3,"draw":1,"loss":0},"season_scope":"full_season","postseason":null,"qualify":{"slots":6,"label_is":"Efri hluti"},"relegation":{"slots":null}}
